search_term,id,title,downloaded_file
american,contemporaryamer23800gut,"Contemporary American Composers Being a Study of the Music of This Country, Its Present Conditions and Its Future, with Critical Estimates and Biographies of the Principal Living Composers; and an Abundance of Portraits, Fac-simile Musical Autographs, and Compositions",DownloadedFiles/contemporaryamer23800gut/23800-8.txt
indians,americanindians35915gut,"American Indians",DownloadedFiles/americanindians35915gut/35915-0.txt
little,americanindians35915gut,"American Indians",DownloadedFiles/americanindians35915gut/35915-0.txt
electronic,littlestoriesfor22896gut,"Little Stories for Little Children",DownloadedFiles/littlestoriesfor22896gut/22896.txt
scotty,theelectronicmin28813gut,"The Electronic Mind Reader",DownloadedFiles/theelectronicmin28813gut/28813-8.txt