search_term,id,title,downloaded_file
dorothy,stgeorgeandstmic05753gut,"St. George and St. Michael",DownloadedFiles/stgeorgeandstmic05753gut/ssgmc10.txt
baptism,dorothypage32577gut,"Dorothy Page",DownloadedFiles/dorothypage32577gut/32577.txt
children,berthaandherbapt20428gut,"Bertha and Her Baptism",DownloadedFiles/berthaandherbapt20428gut/20428-8.txt
stanhope,gritlischildren15727gut,"Gritli's Children",DownloadedFiles/gritlischildren15727gut/15727-8.txt
collingwood,theletterbagofla07253gut,"The Letter-Bag of Lady Elizabeth Spencer-Stanhope - Volume 1",DownloadedFiles/theletterbagofla07253gut/7llss10.txt
dodgson,thelifeandletter11483gut,"The Life and Letters of Lewis Carroll (Rev. C. L. Dodgson)",DownloadedFiles/thelifeandletter11483gut/11483-8.txt
little,thelifeandletter11483gut,"The Life and Letters of Lewis Carroll (Rev. C. L. Dodgson)",DownloadedFiles/thelifeandletter11483gut/11483-8.txt
electronic,littlestoriesfor22896gut,"Little Stories for Little Children",DownloadedFiles/littlestoriesfor22896gut/22896.txt
scotty,theelectronicmin28813gut,"The Electronic Mind Reader",DownloadedFiles/theelectronicmin28813gut/28813-8.txt