search_term,id,title,downloaded_file
prospero,1ws4110,"Tempest",DownloadedFiles/1ws4110/1ws4110.txt
dolores,myfriendprospero14682gut,"My Friend Prospero",DownloadedFiles/myfriendprospero14682gut/14682-8.txt
little,operaseverychild28711gut,"Operas Every Child Should Know Descriptions of the Text and Music of Some of the Most Famous Masterpieces",DownloadedFiles/operaseverychild28711gut/28711-8.txt
electronic,littlestoriesfor22896gut,"Little Stories for Little Children",DownloadedFiles/littlestoriesfor22896gut/22896.txt
scotty,theelectronicmin28813gut,"The Electronic Mind Reader",DownloadedFiles/theelectronicmin28813gut/28813-8.txt